,Nome:,Preço:,Vendedor:,Parcelas e Valor,Avaliação:
0,Kit Chuveiro Ducha Eletro Loren Shower 110v/220v Lorenzetti,"R$157,90",LOJAS NEON OFICIAL,"em 4x R$ 35,53 sem juros",4.8
1,Chuveiro Elétrico Econômico Bella Ducha 4t 6800w Lorenzetti,"R$77,90",COMERCIAL PAQUETÁ,"em 12x R$ 7,57",4.8
2,Chuveiro Ducha Loren Shower Ultra Eletrônico Lorenzetti,"R$130,90", LOJAS MAGUILAR,"em 12x R$ 12,72",4.7
3,Chuveiro elétrico de parede Fame Granducha branco 7000W 220V,"R$226,90",Betinho Eletro,"em 6x R$ 33,28 sem juros",4.6
4,Chuveiro Eletrônico 220v 6800w Fit Black Hydra Deca,"R$140,90",ABC da Construção,"em 12x R$ 13,70",4.5
5,Chuveiro elétrico de parede Tramontina Senseday branco 4400W 220V,"R$46,40", MAXIMOITAQUA,"em 12x R$ 4,50",4.5
6,Chuveiro Ducha Advanced Multitemperaturas 127/220 Lorenzetti,"R$162,90", LOJAS MAGUILAR,"em 12x R$ 15,83",4.7
7,Chuveiro elétrico de parede Zagonel Sublime branco 7500W 220V,R$162,Alpha Ômega,"em 12x R$ 15,75",4.5
8,Chuveiro elétrico de parede Lorenzetti Acqua Ultra Star branco 6800W 220V,R$325, PORTALCONSTRUCAO,"em 12x R$ 31,51",4.7
9,Chuveiro elétrico de parede Lorenzetti Acqua Ultra Star branco 6800W 220V,"R$355,90",CASA & OFICINA,"em 10x R$ 35,59 sem juros",4.7
